{
  "$schema": "./tokens.schema.json",
  "version": 1,
  "defaultPalette": "tatakai-violet",
  "palettes": {
    "tatakai-violet": {
      "label": "Tatakai Violet",
      "seed": "#7C4DFF",
      "style": "Expressive",
      "contrast": 0,
      "amoledCapable": true
    },
    "midnight": {
      "label": "Midnight",
      "seed": "#3D5AFE",
      "style": "TonalSpot",
      "contrast": 0,
      "amoledCapable": true
    },
    "sakura": {
      "label": "Sakura",
      "seed": "#E86A92",
      "style": "Expressive",
      "contrast": 0,
      "amoledCapable": true
    },
    "matcha": {
      "label": "Matcha",
      "seed": "#5E9E6E",
      "style": "TonalSpot",
      "contrast": 0,
      "amoledCapable": true
    },
    "ocean": {
      "label": "Ocean",
      "seed": "#0091C2",
      "style": "Vibrant",
      "contrast": 0,
      "amoledCapable": true
    },
    "neon-tokyo": {
      "label": "Neon Tokyo",
      "seed": "#FF2E88",
      "style": "Vibrant",
      "contrast": 0,
      "amoledCapable": true
    },
    "blood-moon": {
      "label": "Blood Moon",
      "seed": "#C62828",
      "style": "Fidelity",
      "contrast": 0,
      "amoledCapable": true
    },
    "royal-gold": {
      "label": "Royal Gold",
      "seed": "#C9A227",
      "style": "Fidelity",
      "contrast": 0,
      "amoledCapable": true
    },
    "aurora": {
      "label": "Aurora",
      "seed": "#00BFA5",
      "style": "Expressive",
      "contrast": 0,
      "amoledCapable": true
    },
    "mono": {
      "label": "Mono",
      "seed": "#808080",
      "style": "Monochrome",
      "contrast": 1,
      "amoledCapable": true
    }
  },
  "allowContrastFailures": [],
  "fonts": {
    "display": "Space Grotesk",
    "text": "Outfit",
    "mono": "JetBrains Mono"
  },
  "typography": {
    "tvScale": 1.15,
    "roles": {
      "displayLarge": {
        "font": "display",
        "size": 57,
        "lineHeight": 64,
        "weight": 400,
        "tracking": -0.25,
        "emphasizedWeight": 600
      },
      "displayMedium": {
        "font": "display",
        "size": 45,
        "lineHeight": 52,
        "weight": 400,
        "tracking": 0,
        "emphasizedWeight": 600
      },
      "displaySmall": {
        "font": "display",
        "size": 36,
        "lineHeight": 44,
        "weight": 400,
        "tracking": 0,
        "emphasizedWeight": 600
      },
      "headlineLarge": {
        "font": "display",
        "size": 32,
        "lineHeight": 40,
        "weight": 400,
        "tracking": 0,
        "emphasizedWeight": 600
      },
      "headlineMedium": {
        "font": "display",
        "size": 28,
        "lineHeight": 36,
        "weight": 400,
        "tracking": 0,
        "emphasizedWeight": 600
      },
      "headlineSmall": {
        "font": "display",
        "size": 24,
        "lineHeight": 32,
        "weight": 400,
        "tracking": 0,
        "emphasizedWeight": 600
      },
      "titleLarge": {
        "font": "display",
        "size": 22,
        "lineHeight": 28,
        "weight": 400,
        "tracking": 0,
        "emphasizedWeight": 600
      },
      "titleMedium": {
        "font": "display",
        "size": 16,
        "lineHeight": 24,
        "weight": 500,
        "tracking": 0.15,
        "emphasizedWeight": 700
      },
      "titleSmall": {
        "font": "display",
        "size": 14,
        "lineHeight": 20,
        "weight": 500,
        "tracking": 0.1,
        "emphasizedWeight": 700
      },
      "bodyLarge": {
        "font": "text",
        "size": 16,
        "lineHeight": 24,
        "weight": 400,
        "tracking": 0.5,
        "emphasizedWeight": 500
      },
      "bodyMedium": {
        "font": "text",
        "size": 14,
        "lineHeight": 20,
        "weight": 400,
        "tracking": 0.25,
        "emphasizedWeight": 500
      },
      "bodySmall": {
        "font": "text",
        "size": 12,
        "lineHeight": 16,
        "weight": 400,
        "tracking": 0.4,
        "emphasizedWeight": 500
      },
      "labelLarge": {
        "font": "text",
        "size": 14,
        "lineHeight": 20,
        "weight": 500,
        "tracking": 0.1,
        "emphasizedWeight": 600
      },
      "labelMedium": {
        "font": "text",
        "size": 12,
        "lineHeight": 16,
        "weight": 500,
        "tracking": 0.5,
        "emphasizedWeight": 600
      },
      "labelSmall": {
        "font": "text",
        "size": 11,
        "lineHeight": 16,
        "weight": 500,
        "tracking": 0.5,
        "emphasizedWeight": 600
      }
    }
  },
  "shape": {
    "none": 0,
    "extraSmall": 4,
    "small": 8,
    "medium": 12,
    "large": 16,
    "largeIncreased": 20,
    "extraLarge": 28,
    "extraLargeIncreased": 32,
    "extraExtraLarge": 48,
    "full": 9999
  },
  "spacing": {
    "unit": 4,
    "scale": [
      0,
      2,
      4,
      8,
      12,
      16,
      20,
      24,
      32,
      40,
      48,
      64
    ]
  },
  "motion": {
    "spatial": {
      "fast": {
        "damping": 0.9,
        "stiffness": 1400
      },
      "default": {
        "damping": 0.9,
        "stiffness": 700
      },
      "slow": {
        "damping": 0.9,
        "stiffness": 300
      }
    },
    "effects": {
      "fast": {
        "damping": 1,
        "stiffness": 3800
      },
      "default": {
        "damping": 1,
        "stiffness": 1600
      },
      "slow": {
        "damping": 1,
        "stiffness": 800
      }
    }
  },
  "density": {
    "phone": 0,
    "tablet": 0,
    "desktop": -1,
    "tv": 1
  },
  "elevation": [
    0,
    1,
    3,
    6,
    8,
    12
  ]
}
